{
  "$schema": "https://json-schema.org/draft/2020-12/schema",
  "additionalProperties": false,
  "properties": {
    "edges": {
      "items": {
        "additionalProperties": false,
        "properties": {
          "from": {
            "type": "string"
          },
          "source": {
            "anyOf": [
              {
                "additionalProperties": false,
                "properties": {
                  "end": {
                    "type": "integer"
                  },
                  "line": {
                    "type": "integer"
                  },
                  "path": {
                    "type": "string"
                  },
                  "sha256": {
                    "pattern": "^[0-9a-f]{64}$",
                    "type": "string"
                  }
                },
                "required": [
                  "path",
                  "line",
                  "end",
                  "sha256"
                ],
                "type": "object"
              },
              {
                "additionalProperties": false,
                "properties": {
                  "doc": {
                    "type": "string"
                  },
                  "quote": {
                    "type": "string"
                  },
                  "section": {
                    "type": "string"
                  }
                },
                "required": [
                  "doc",
                  "section"
                ],
                "type": "object"
              }
            ]
          },
          "to": {
            "type": "string"
          },
          "verb": {
            "type": "string"
          }
        },
        "required": [
          "from",
          "to",
          "verb"
        ],
        "type": "object"
      },
      "type": "array"
    },
    "environments": {
      "items": {
        "additionalProperties": false,
        "properties": {
          "id": {
            "pattern": "^[A-Za-z0-9][A-Za-z0-9._/:@-]*$",
            "type": "string"
          },
          "name": {
            "type": "string"
          },
          "project_id": {
            "type": "string"
          },
          "properties": {
            "type": "object"
          },
          "proposed": {
            "additionalProperties": false,
            "properties": {
              "date": {
                "type": "string"
              },
              "model": {
                "type": "string"
              },
              "prompt": {
                "type": "string"
              }
            },
            "required": [
              "model",
              "prompt",
              "date"
            ],
            "type": "object"
          },
          "purpose": {
            "type": "string"
          },
          "source": {
            "anyOf": [
              {
                "additionalProperties": false,
                "properties": {
                  "end": {
                    "type": "integer"
                  },
                  "line": {
                    "type": "integer"
                  },
                  "path": {
                    "type": "string"
                  },
                  "sha256": {
                    "pattern": "^[0-9a-f]{64}$",
                    "type": "string"
                  }
                },
                "required": [
                  "path",
                  "line",
                  "end",
                  "sha256"
                ],
                "type": "object"
              },
              {
                "additionalProperties": false,
                "properties": {
                  "doc": {
                    "type": "string"
                  },
                  "quote": {
                    "type": "string"
                  },
                  "section": {
                    "type": "string"
                  }
                },
                "required": [
                  "doc",
                  "section"
                ],
                "type": "object"
              }
            ]
          },
          "status": {
            "type": "string"
          }
        },
        "required": [
          "id",
          "name",
          "source"
        ],
        "type": "object"
      },
      "type": "array"
    },
    "layer": {
      "const": "deploy"
    },
    "pipelines": {
      "items": {
        "additionalProperties": false,
        "properties": {
          "file": {
            "type": "string"
          },
          "id": {
            "pattern": "^[A-Za-z0-9][A-Za-z0-9._/:@-]*$",
            "type": "string"
          },
          "jobs": {
            "items": {
              "additionalProperties": false,
              "properties": {
                "does": {
                  "type": "string"
                },
                "id": {
                  "pattern": "^[A-Za-z0-9][A-Za-z0-9._/:@-]*$",
                  "type": "string"
                },
                "name": {
                  "type": "string"
                },
                "on_failure": {
                  "type": "string"
                },
                "source": {
                  "anyOf": [
                    {
                      "additionalProperties": false,
                      "properties": {
                        "end": {
                          "type": "integer"
                        },
                        "line": {
                          "type": "integer"
                        },
                        "path": {
                          "type": "string"
                        },
                        "sha256": {
                          "pattern": "^[0-9a-f]{64}$",
                          "type": "string"
                        }
                      },
                      "required": [
                        "path",
                        "line",
                        "end",
                        "sha256"
                      ],
                      "type": "object"
                    },
                    {
                      "additionalProperties": false,
                      "properties": {
                        "doc": {
                          "type": "string"
                        },
                        "quote": {
                          "type": "string"
                        },
                        "section": {
                          "type": "string"
                        }
                      },
                      "required": [
                        "doc",
                        "section"
                      ],
                      "type": "object"
                    }
                  ]
                },
                "when": {
                  "type": "string"
                }
              },
              "required": [
                "id",
                "name",
                "when",
                "does"
              ],
              "type": "object"
            },
            "type": "array"
          },
          "name": {
            "type": "string"
          },
          "properties": {
            "type": "object"
          },
          "proposed": {
            "additionalProperties": false,
            "properties": {
              "date": {
                "type": "string"
              },
              "model": {
                "type": "string"
              },
              "prompt": {
                "type": "string"
              }
            },
            "required": [
              "model",
              "prompt",
              "date"
            ],
            "type": "object"
          },
          "source": {
            "anyOf": [
              {
                "additionalProperties": false,
                "properties": {
                  "end": {
                    "type": "integer"
                  },
                  "line": {
                    "type": "integer"
                  },
                  "path": {
                    "type": "string"
                  },
                  "sha256": {
                    "pattern": "^[0-9a-f]{64}$",
                    "type": "string"
                  }
                },
                "required": [
                  "path",
                  "line",
                  "end",
                  "sha256"
                ],
                "type": "object"
              },
              {
                "additionalProperties": false,
                "properties": {
                  "doc": {
                    "type": "string"
                  },
                  "quote": {
                    "type": "string"
                  },
                  "section": {
                    "type": "string"
                  }
                },
                "required": [
                  "doc",
                  "section"
                ],
                "type": "object"
              }
            ]
          }
        },
        "required": [
          "id",
          "name",
          "source",
          "jobs"
        ],
        "type": "object"
      },
      "type": "array"
    },
    "provenance": {
      "additionalProperties": false,
      "properties": {
        "accepted_by": {
          "anyOf": [
            {
              "additionalProperties": false,
              "properties": {
                "date": {
                  "pattern": "^\\d{4}-\\d{2}-\\d{2}$",
                  "type": "string"
                },
                "note": {
                  "type": "string"
                },
                "who": {
                  "type": "string"
                }
              },
              "required": [
                "who",
                "date"
              ],
              "type": "object"
            },
            {
              "type": "null"
            }
          ]
        },
        "brief_corrections": {
          "type": "string"
        },
        "kind": {
          "const": "intent"
        },
        "source_doc": {
          "type": "string"
        },
        "written_by": {
          "additionalProperties": false,
          "properties": {
            "date": {
              "pattern": "^\\d{4}-\\d{2}-\\d{2}$",
              "type": "string"
            },
            "note": {
              "type": "string"
            },
            "who": {
              "type": "string"
            }
          },
          "required": [
            "who",
            "date"
          ],
          "type": "object"
        }
      },
      "required": [
        "kind",
        "source_doc",
        "written_by",
        "accepted_by"
      ],
      "type": "object"
    },
    "resources": {
      "items": {
        "additionalProperties": false,
        "properties": {
          "environment": {
            "type": "string"
          },
          "id": {
            "pattern": "^[A-Za-z0-9][A-Za-z0-9._/:@-]*$",
            "type": "string"
          },
          "kind": {
            "type": "string"
          },
          "name": {
            "type": "string"
          },
          "properties": {
            "type": "object"
          },
          "proposed": {
            "additionalProperties": false,
            "properties": {
              "date": {
                "type": "string"
              },
              "model": {
                "type": "string"
              },
              "prompt": {
                "type": "string"
              }
            },
            "required": [
              "model",
              "prompt",
              "date"
            ],
            "type": "object"
          },
          "source": {
            "anyOf": [
              {
                "additionalProperties": false,
                "properties": {
                  "end": {
                    "type": "integer"
                  },
                  "line": {
                    "type": "integer"
                  },
                  "path": {
                    "type": "string"
                  },
                  "sha256": {
                    "pattern": "^[0-9a-f]{64}$",
                    "type": "string"
                  }
                },
                "required": [
                  "path",
                  "line",
                  "end",
                  "sha256"
                ],
                "type": "object"
              },
              {
                "additionalProperties": false,
                "properties": {
                  "doc": {
                    "type": "string"
                  },
                  "quote": {
                    "type": "string"
                  },
                  "section": {
                    "type": "string"
                  }
                },
                "required": [
                  "doc",
                  "section"
                ],
                "type": "object"
              }
            ]
          }
        },
        "required": [
          "id",
          "name",
          "source",
          "kind"
        ],
        "type": "object"
      },
      "type": "array"
    }
  },
  "required": [
    "layer",
    "provenance",
    "environments",
    "resources",
    "pipelines",
    "edges"
  ],
  "title": "review/intent/deploy.json",
  "type": "object"
}
